{
  "scenario_id": "scn_123",
  "variant_id": "var_456",
  "load_profile": {
    "type": "ramp",
    "duration_sec": 300,
    "start_rps": 50,
    "end_rps": 1000,
    "concurrency": 200,
    "request_mix": {
      "read": 0.8,
      "write": 0.2
    }
  },
  "sandbox_profile": "medium",
  "safety_overrides": {
    "max_cpu_pct": 85,
    "max_memory_mb": 2048
  }
}

